{
  "$schema": "../schemas/project.schema.json",
  "types": [
    "Minecraft",
    "Videogame"
  ],
  "date": "2013",
  "title": "Zombie Survival",
  "description": [
    "*Zombie Survival* is a **Minecraft defense game** inspired by *Call of Duty's Zombies* mode, where players defend against waves of zombies.",
    "I focused on the core mechanics around wave-based combat and defense strategies while ensuring a challenging yet enjoyable experience for players, while also creating a visually appealing environment."
  ],
  "image": "resources/images/projects/zombieSurvival.webp",
  "imageStretched": true,
  "imageAlt": "Zombie Survival gameplay",
  "skills": [
    "Modding",
    "Game Design",
    "Project Management"
  ],
  "links": [
    {
      "type": "download",
      "url": "resources/deliverables/Minecraft/Worlds/201305 - Zombie Survival.rar"
    },
    {
      "type": "play",
      "url": "https://youtu.be/chfp5sMP97o"
    }
  ]
}