{
  "$schema": "../schemas/project.schema.json",
  "types": ["Web", "Videogame"],
  "date": "2026",
  "title": "Akwaaba Monsters",
  "description": [
    "*Akwaaba Monsters* is a **handheld-style creature-collecting game** set in tropical Ghana, built around a trip I took there with friends. Seven of its creatures are those friends.",
    "I directed the concept and the **architecture**: a **turn-based battle engine**, a declarative **script engine** for every conversation, and a save that exports to a file. It ships **no image or audio files**: every creature, tile, letter and note is generated in the browser.",
    "The world itself is tested, not just the code, and it is built to grow one area at a time."
  ],
  "skills": ["Vibe Coded", "Architecture", "Game Design", "UI/UX"],
  "image": "resources/images/projects/akwaabaMonsters.webp",
  "imageStretched": true,
  "imageAlt": "Headline \"Catch monsters across Ghana\" above two pixel-art game screens: a battle between the creatures Hinoko and Polete, and the player on the dirt roads of Aduma village among thatched huts",
  "links": [
    {
      "url": "web-projects/akwaaba-monsters/"
    },
    {
      "type": "github",
      "url": "https://github.com/guplem/guplem.github.io/tree/main/web-projects/akwaaba-monsters"
    }
  ]
}
