{
  "$schema": "../schemas/project.schema.json",
  "types": ["Web"],
  "date": "2026",
  "title": "Sticker Studio for WhatsApp",
  "description": [
    "*Sticker Studio* is a **web tool that turns a photo or a video into a WhatsApp sticker**: it cuts out the background, frames and colours the picture, adds captions, and merges pictures into an animation. A video becomes an animated sticker: pick the clip, and the tool samples it into frames.",
    "Browsers can only encode one still picture, so I **wrote the animated WebP writer myself**, packing frames into the container rather than compressing them. The background is found by colour from the frame edges, with no model.",
    "Stickers are checked against **WhatsApp's own validator source**, which differs from its written guide on four rules. The pixel work is **test-covered**, and nothing leaves the device."
  ],
  "skills": ["Vibe Coded", "Architecture", "UI/UX", "Frontend"],
  "image": "resources/images/projects/whatsappStickerCreator.webp",
  "imageStretched": true,
  "imageAlt": "Headline \"Any photo, a sticker in seconds.\" above three panels: a photo of a cat in a room, the cut-out cat with a white outline and a HELLO! caption on a transparency checkerboard with passed size checks, and the same sticker sent in a chat",
  "links": [
    { "url": "web-projects/whatsapp-sticker-creator/" },
    {
      "type": "github",
      "url": "https://github.com/guplem/guplem.github.io/tree/main/web-projects/whatsapp-sticker-creator"
    }
  ]
}
