{
  "$schema": "../schemas/project.schema.json",
  "types": [
    "Minecraft",
    "Videogame"
  ],
  "date": "2013",
  "title": "Defend Your Base 2",
  "description": [
    "*Defend Your Base 2* is the sequel to **Defend Your Base**, introducing a new space-themed map and gameplay refinements based on user feedback.",
    "I developed new mechanics, map design, and organized a small in-game tournament to test the new features with the community."
  ],
  "image": "resources/images/projects/defendYourBase2.webp",
  "imageStretched": true,
  "imageAlt": "Defend Your Base 2 gameplay",
  "skills": [
    "Modding",
    "Game Design",
    "Project Management"
  ],
  "links": [
    {
      "type": "play",
      "url": "https://youtu.be/tx8Pq1m49Vk"
    }
  ]
}